name,type,url,contact,description,geoextent,geocoverage,lead_organisation_name,lead_organisation_category,start_date,active,end_date,primary_sector,secondary_sector,cross_sector,cross_border,technology,status,uptake
Kamu - chatbot about immigration processes ,Unknown,https://migri.fi/en/chat1,,Kamu is a chatbot used by the Finnish Immigration Service that gives general advice to citizens about immigration processes or about the process of the application. ,National,Finland,Finnish Immigration Service,Governmental,2021/01/01,Unknown,,General public services,General public services n.e.c.,Unknown,Unknown,Natural language processing,Unknown,Unknown
OuloBot - virtual assistant for business,Unknown,https://www.ouka.fi/oulu/oulubot/,,"The City of Oulu has started a project co-financed by Business Finland, which aims to build a chatbot service, OuluBot. The goal for OuluBot is to become a virtual assistant in all everyday issues, whether they concern tourism, companies or city services. The answer or guidance to an electronic service should be provided regardless of time, place, medium and language. Technically, chatbot retrieves information e.g. relevant City of Oulu websites, chat history, guidance information, databases, and other information sources. OuluBot is available 24/7 service. independent of working hours. If the user is looking for information that OuluBot would not be able to answer, then during office hours the discussion could be directed to the City of Oulu chat service (Oulu10 general counseling customer service).",Local,Finland,Municipality of Oulu,Governmental,2021/01/01,Unknown,,General public services,"Executive and legislative organs, financial and fiscal affairs, external affairs.",Unknown,Unknown,Natural language processing,Unknown,Unknown
ClaudIA - chatbot for the invoicing portal for purchases by public authorities,Unknown,https://www.cio-online.com/actualites/lire-chorus-pro-aussi-aide-ses-utilisateurs-avec-un-chatbot-10199.html,,"Chatbot has been put in place by the AIFE (State Financial IT Agency) for users of the information system Chorus of SME's and microbusinesses. Available since the end of 2017, this chatbot, called Claudia, is based on IBM's Watson artificial intelligence technology. The AIFE indicates that the number of support contacts ""has not stopped increasing, going from 20,000 per month to more than 40,000 (with a peak at 55,000 in January) all channels combined (phone calls, files, live chat , emails, avatar, chatbot). The requests handled manually by level 1 support operators now represent a volume of more than 15,000 per month (18,000 in January!). The AIFE anticipates a doubling of support requests each year. Before Claudia, only half of the requests were processed automatically. Today, the rate has risen to 65%. “In two months, ClaudIA handled more than 10,000 conversations, with an average of 3.5 interactions per conversation,” says AIFE. Claudia takes the user context into account and knows how to detect inappropriate interactions.",National,France,State Financial IT Agency,Governmental,2021/01/01,Unknown,,General public services,"Executive and legislative organs, financial and fiscal affairs, external affairs.",Unknown,Unknown,Natural language processing,Unknown,Unknown
French Fraud - fraud detection value declarations,Unknown,https://www.aiforhumanity.fr/pdfs/MissionVillani_Report_ENG-VF.pdf,,A supervised deep mining algorithm is used by French customs in order to detect fraud with value declarations and to analyze cases of identiy fraud or import trafficiking.,National,France,French Customs,Governmental,2021/01/01,Unknown,,Public order and safety,Police Services,Unknown,Unknown,Unknown,Unknown,Unknown
LaBonneBoîte - identification of companies with a high probability of hiring,Unknown,https://ec.europa.eu/social/BlobServlet?docId=20605&langId=en,,"La Bonne Boite is an online tool that identifies companies with a high probability of hiring within the next six months in the sector and area selected by the seeker. The objective of La Bonne Boite is to help jobseekers find job opportunities that are not published by employers (i.e. ""hidden vacancies"") and to predict which companies are most likely to hire in the near  future. La Bonne Boite is one of the most used job searching services in France and it is about to be further developed in order to target more specific types of jobseekers, like students, that are looking for part-time jobs. This search engine improves a jobseeker's chance of securing a job interview on the basis of spontaneous job applications. La Bonne Boite's computer code can be copied and used by others. There is also an Application Programming Interface (API) which enables the duplication of La Bonne Boite on other websites. ",National,France,Pôle emploi,Governmental,2021/01/01,Unknown,,Social protection,Unemployment.,Unknown,Unknown,Searching,Unknown,Unknown
SignauxFaibles - predictive analysis of business difficulties,Unknown,https://beta.gouv.fr/startups/signaux-faibles.html,,"The detection of weak signals, which indicate a deterioration in the company's situation, makes it possible to identify more early the companies on which support actions can be offered to the company manager. The innovations relate to: (1) The development of a detection algorithm that uses relevant data and variables and effectively detects companies in difficulty (URSSAF, DIRECCTE, Banque de France data, etc.); (2) The development of a data loading computer system capable of regularly and automatically refreshing data from operational databases. The objective is to dynamically detect 2 to 5 new SMEs per month on the scale of Bourgogne Franche-Comté. Expected impacts in terms of digital transformation: an even more effective decentralized State action to support weakened companies. Ultimately, it is a real “secure social network” centered on the company which will become the daily tool of public actors mobilized around companies in difficulty .Initiated in 2014 on a very local scale, the national deployment of Weak Signals was approved on April 3, 2019 thanks to the signing of an agreement by the historical partners of the project. This partnership allows the establishment of a long-term team that makes scaling possible. For the detailed account of this adventure, read this blog post .",National,France,"Ministry of the Economy, Finance and Recovery - General Directorate of Enterprises (DGE) / Ministry of Labor (DGEFP)",Governmental,2021/01/01,Unknown,,Economic affairs,"General economic, commercial and labour affair",Unknown,Unknown,Machine learning,Unknown,Unknown
C-19 - Interdepartmental chatbot on the topic of Corona.,Unknown,https://chatbot.it.bund.de/,,"Citizens want to receive quick and easy-to-understand information, also about Covid 19 issues. Various channels are available to them for this purpose (including post, e-mail, telephone, personal auditions), but some of these are tied to opening hours and tie up staff resources in the authorities. Since the beginning of the pandemic, the number of enquiries in the public services has increased by up to ten times.A chatbot automatically answers questions from citizens. In the process, existing FAQs are entered as building blocks for a dialogue. In the future, chatbots will have functions for creating applications and clarifying status. The AI components will used primarily for speech recognition, but also for processing the dialogues conducted. C-19 Chatbot provides pre-formulated answers and references to further sources of information",National,Germany,ITZBund ,Governmental,2021/01/01,Unknown,,General public services,General services.,Unknown,Unknown,Natural language processing,Unknown,Unknown
Germany's Federal Office for Migrants and Refugees - Refugee Language Detection,Unknown,https://www.dw.com/en/automatic-speech-analysis-software-used-to-verify-refugees-dialects/a-37980819,,"Germany's Federal Office for Migrants and Refugees uses a voice recognition software that seeks to identify which country migrants without documentation are from. The Federal Office for Migrants and Refugees said the automated new system would begin within two weeks. The aim is to detect Arabic-speaking migrants claiming to be Syrian to increase their chances of asylum. The new software will run alongside techniques already in use to establish a person's identity. A variety of data will be examined, including the asylum-seeker's documentation, before a final decision is made. If necessary, officials will also seek expert opinion. Linguists argue it would, however, be challenging for an automatic machine to be completely accurate, as language and vocabulary are ever-changing, reducing the effectiveness and accuracy. ",National,Germany,Federal Office for Migration and Refugees (BAMF),Governmental,2021/01/01,Unknown,,Public order and safety,Public order and safety n.e.c.,Unknown,Unknown,Audio processing,Unknown,Unknown
Govbot -  administrative search engine for citizens' enquiries ,Unknown,https://publicplan.de/projekt/verwaltungssuchmaschine-nrw,,"GovBot which is in use with the administrative search engine of the administration of the German State North Rhine-Westphalia. The search engine for administrative matters guarantees citizens easy and clear access to information. It indexes all websites of the state of North Rhine-Westphalia, the regional associations, many chambers, all districts and municipalities of the state of North Rhine-Westphalia and thus accesses over 12 million individual websites in a search index. Using their own search interface, users can search for administrative terms and problems, are pointed out to correct administrative terms with search word recommendations and, if necessary, are given specific responsibilities for a problem. The full text search result - broken down by administrative level - completes the offer, with a map section showing the specific location of the relevant authority. https://www.verwaltungssuchmaschine.nrw/",Regional,Germany,Ministerium für Inneres und Kommunales des Landes Nordrhein-Westfalen,Governmental,2021/01/01,Unknown,,General public services,"Executive and legislative organs, financial and fiscal affairs, external affairs.",Unknown,Unknown,Searching,Unknown,Unknown
CERTH-MUKA - Public Organizations Multi-factor Misinformation Handling ,Unknown,https://www.etapasproject.eu/usecases/post-4/,,"A pilot project of the ETAPAS project. The deployment of AI for fake news detection and prioritization of emerging issues in the municipality of Katerini (Greece) is assessed by the ETAPAS framework to identify all relevant ethical and social risks and propose mitigation actions, eliminating any relevant risks and unforeseen consequences.",Local,Greece,ETAPAS project: Municipality of Katerini ,Governmental,2021/01/01,Unknown,,General public services,General public services n.e.c.,Unknown,Unknown,Natural language processing,Unknown,Unknown
Home Quarantine App - Supporting the use of electronic control for home quarantine,Unknown,https://metamorphosis.org.mk/wp-content/uploads/2021/04/algovrithms_2.0_report-2021.pdf,,"In early May 2020, a Government Decree has allowed the use of electronic control for home quarantine. The developer company, Asura Technologies, who approached the government with the idea of the Home Quarantine App. Asura is a Hungarian company with experience facial recognition and GPS-location technologies. Though all personal data remains with the state and Asura has no access to them (they just establish a connection between them), the app itself is operated by the developer company.The use of the app is voluntary; however, the relevant decree encourages its use as the fines for infringement of quarantine rules are lower if one agrees to use the app.",National,Hungary,Unknown,Governmental,2021/01/01,Unknown,,Health,Health n.e.c.,Unknown,Unknown,Computer vision,Unknown,Unknown
Véda-KAFIR-ROBOTZSARU (‘Robocop’) - System Operated by the Police for Traffic Safety Automated Processing,Unknown,https://metamorphosis.org.mk/wp-content/uploads/2021/04/algovrithms_2.0_report-2021.pdf,,"Véda is an intelligent road traffic camera system, which provides data to KAFIR (Közlekedésbiztonsági Automatizált Feldolgozó és Információs Rendszer - Traffic Safety Automated Processing and Information System). Together with the solutions provided by Robotzsaru (‘Robocop’), an integrated administration, case processing and electronic records management system, basically the main software of the police, fines for road traffic violations are almost automatic The cameras record the registration number, speed of the vehicle, the coordinates of the location, the date and time of the event. This data is transferred to the KAFIR, which cross-checks data with the traffic registry (e.g., if the vehicle is stolen) and uploads everything together in the Robotzsaru IT system. The generated files are then classified and transmitted to the responsible authority. Up to this point, there is no possibility for human interference. Possible infringements are punishable under no-fault liability and the data is unquestionable, even if the decision is made automatically. However, there is an ex-post check by the administrator.",National,Hungary,Hungarian Police,Governmental,2021/01/01,Unknown,,Economic affairs,Transport,Unknown,Unknown,Computer vision,Unknown,Unknown
The Dublin Beat - citizen opinion analysis,Unknown,https://smartdublin.ie/smart-dublin-explores-how-ai-social-media-can-help-improve-the-city-region/,,"The Dublin Beat analyses citizen opinions in the Dublin Region for an overview of their most pressing concerns. Each month public tweets are collated by the AItext analytics platform Citibeats, whose artificial intelligence algorithms have been trained for understanding opinions in the local context of Dublin. This can assist local authorities to better understand how local people feel about civic issues.  The resulting analysis based on the gathered online data is presented via visual dashboards and through monthly reports provided online. The different reports give an overview of key issues such as how people feel about environmental issues, cultural events or city region developments expressed on the online media. The Dublin Beat can help local authorities to better understand how citizens feel about key issues and ensure that civic efforts and policy reflect the needs of communities. But of course, it is important to note that these insights are indicative only of the sentiments expressed by a cohort of citizens who use social media. Local authorities employ other methods to ensure truly inclusive citizen engagement.",Local,Ireland,Municipality of Dublin,Governmental,2021/01/01,Unknown,,General public services,R&D general public services.,Unknown,Unknown,Natural language processing,Unknown,Unknown
VDA - voicebot on calls from Irish taxpayer on tax clearance,Unknown,https://www.ops2020.gov.ie/actions/innovating-for-our-future/innovation/emerging-technology/artificial-intelligence/revenue-chatbot/,,"In early 2018, the Irish Revenue Commissioners began investigating the potential of Artificial Intelligence to provide a more efficient, effective experience for customers using their telephony services. A pilot project was initiated to examine if AI based Natural Language Processing (NLP) technologies could be used to deliver an improved customer service, reduce costs and increase efficiencies. This resulted in the implementation of a Virtual Digital Agent (VDA) or voicebot which was designed to focus on a subset of calls from the Irish taxpayer relating to tax clearance. On a daily basis, taxpayers contact Irish Revenue tax clearance customer support asking how to apply for tax clearance; enquiring what their current tax clearance status is; requesting more information on expired, refused & rescinded tax clearance applications as well as just looking for information on tax clearance itself. It is reported that currently, up to 50% of calls were handled from start to finish by the voicebot,  70% of first-time applicants engaged with the voicebot when submitting their application, 75% of tax clearance holders were able to retrieve their tax clearance access number (TCAN). Only in 10% of the calls, the calls were transferred to a human operator due to the inability of the voicebot to understand the request. ",National,Ireland,Irish Revenue Commissioners,Governmental,2021/01/01,Unknown,,General public services,"Executive and legislative organs, financial and fiscal affairs, external affairs.",Unknown,Unknown,Audio processing,Unknown,Unknown
Borbot - virtual assistant for museums,Unknown,https://borbot.it/,,"Borbot  (acronym for Bourbons and Robotics) is a virtual assistant, adopted by the National Museum of the Royal Palace of Caserta, which through machine learning techniques is able to answer user questions, providing detailed tourist information and news about the monument. The mobile system supports the Museum's front office service and allows customer service staff to concentrate on the services with greater added value.",Local,Italy,Reggia di Caserta,Governmental,2021/01/01,Unknown,,"Recreation, culture and religion",Cultural services.,Unknown,Unknown,Unknown,Unknown,Unknown
R1 - humanoid robot,Unknown,https://www.dongnocchi.it/news-ed-eventi/@news/robot-e-realta-virtuale-a-technology-hub-ecco-la-riabilitazione-innovativa,,"R1, the humanoid robot designed to assist us on several occasions. R1 is equipped with sophisticated mechanics, sensors and artificial intelligence that make it one of the most complete humanoids on the international scene. R1, used as a pilot project at the ETAPAS H2020 project (https://www.etapasproject.eu/usecases/post-2/),  will be able to be used as a low-cost assistive-rehabilitation robot in rehabilitation gyms to integrate more traditional treatments, support the clinical-assistance staff in the ward, as well as at the patient's home, where he can bring objects, help the assisted person to find them or to take them if difficult to reach. R1 will also be able to remember appointments or take medicines and recognize falls to manage any emergencies.",National,Italy,ETAPAS project: Fondazione Don Gnocchi (Italy),Governmental,2021/01/01,Unknown,,Health,"Medical products, appliances and equipment.",Unknown,Unknown,Automated reasoning,Unknown,Unknown
Smart Planner - navigation planning assistant,Unknown,https://www.smartcommunitylab.it/app/,,"A planning navigation app (""Viaggia + <name of the city>"") which is based on AI techniques and is able to suggest users who connect through an app from their smartphone the fastest and most ecological solutions to reach a specific destination in the city. Through the analysis of data intercepted from multiple sources, the app gives personalized indications on which public, private or shared means of transport should be used to reduce polluting emissions and travel times. The Smart Planner solution is reported to have been in use in the cities of Trento and Rovereto as well as the Emilia Romagna region.",Local,Italy,"Smart Community Lab an initiative of the FBK research centre  , Smart Community Lab: an initiative of the FBK research centre  (Trento, Italy)",Governmental,2021/01/01,Unknown,,Economic affairs,Transport,Unknown,Unknown,Planning and Scheduling,Unknown,Unknown
FITS ITEMS - road safety ,Unknown,https://investinlatvia.org/en/key-sectors/sectors/smart-city,,"The State Public Traffic Safety Directorate uses the FITS (""Future Intelligent Transport Systems"") ITEMS, which significantly improves road safety and saves people's lives. This AI system is capable of recognizing car numbers for driving speed, ensurance and roadworthiness test control on roads. At the end of 2018, the number of road accidents decreased by 43% compared to the number prior to the installation of photo cameras (1 084, after 613) at the roadside stages where photo cameras were installed and operated. ",National,Latvia,State Public Traffic Safety Directorate,Governmental,2021/01/01,Unknown,,Economic affairs,Transport,Unknown,Unknown,Computer vision,Unknown,Unknown
Hugo - virtual Asssistant,Unknown,https://ec.europa.eu/cefdigital/wiki/download/attachments/61932141/2_04_Janis%20Ziedins_Artus%20Vasiljevskis_Hugo.lv-AI_powered_service.pdf?version=1&modificationDate=1544438787726&api=v2,,"The institution of direct administration under the authority of the Minister for Culture, the Culture Information Systems Centre (hereinafter - KISC), has commenced a single development of a virtual assistant platform of State administration. KISC has created and further developed the language technology platform for public administration, Hugo.lv. The Hugo.lv website provides machine translation, speech recognition and synthesis. National regulatory authorities will have to face challenges when they start using a virtual assistant, as they will have to learn to adapt it to their needs. It should be noted that regulatory frameworks often change and institutions will have to maintain an up-to-date virtual assistant knowledge base. This is a NLP Chatbot for Government which provides SaaP possibility on a shared platform.",National,Latvia,Culture Information Systems Centre Latvia,Governmental,2021/01/01,Unknown,,General public services,General services.,Unknown,Unknown,Natural language processing,Unknown,Unknown
Toms - chatbot facilitating customer communication with the State Revenue service,Unknown,https://www.vid.gov.lv/,,"A Chatbot facilitating customer communication with the State Revenue service (working time, locations, etc.), registration of economic operators, use of the Electronic Declaration System (access facilities, general issues on EDs), annual income statement and eligible expenditure (mandatory submission, types of eligible expenditure, repayment and payment deadlines), as well as the mobile application “Eligible expenditure”.Consulting availability 24/7, freeing employees from answering typical questions.",National,Latvia,State Revenue Service,Governmental,2021/01/01,Unknown,,General public services,"Executive and legislative organs, financial and fiscal affairs, external affairs.",Unknown,Unknown,Natural language processing,Unknown,Unknown
UNA - chatbot regarding the process of enterprise registration,Unknown,https://oecd-opsi.org/innovations/una-the-first-virtual-assistant-of-public-administration-in-latvia/,,"In 2018, the Register of Enterprises of Latvia introduced the Chatbot UNA (Future assistant for entrepreneurs - FAE) to answer frequently asked questions regarding the process of enterprise registration. The name UNA has a symbolic meaning as it stands for the Future Support of Entrepreneurs in the Latvian language. Chatbots are available 24/7 and thus able to make communication between citizens and the state accessible and friendly. UNA is available on both the website of the Register of Enterprises as well as on the Facebook page as part of the Facebook messenger application. UNA is able to answer frequently asked questions about the registration of their businesses as well as the liquidation, merchants, companies and organizations. If citizens already have an application in progress, they are also able to ask about the progress of their documents. At the moment, UNA only works in the Latvian language.  A Latvian company, Tilde, specializing in AI technologies cooperated in the development of UNA. The usage of the conversational agent has been argued to be highly successful and has been nominated for numerous awards such as the OECD's Public Excellence, World Summit Awards and others. According to the first performance indicators, 44% of the questions asked on UNA are considered to be general of nature and easily taken care of by the Chatbot.  ",National,Latvia,Register of Enterprises of the Republic of Latvia,Governmental,2021/01/01,Unknown,,Economic affairs,"General economic, commercial and labour affair",Unknown,Unknown,Natural language processing,Unknown,Unknown
"FCIS - machine learning to identify suspicious patterns (trade, financial flows)",Unknown,http://www.fntt.lt/lt/ivykiai/fntt-kartu-su-partneriais-pradeda-igyvendinti-europos-sajungos-moksliniu-tyrimu-ir-inovaciju-lesomis-remiama-projekta/3768,,"Lithuanian Customs 's Financial Crime Investigations Service are using machine learning to identify suspicious patterns (trade, financial flows). This is part of a H2020 project, which, among other things, will explore using AI for better processing and analysis of data. The project will aim to apply artificial intelligence, data analysis and data visualization methods over two years, allowing law enforcement professionals to link, prioritize and analyze information gathered from different sources to facilitate decision-making. Several organizational units will be directly involved in the development of a targeted data processing and analysis system.",National,Lithuania,Lithuanian customs,Governmental,2021/01/01,Unknown,,Public order and safety,Public order and safety n.e.c.,Unknown,Unknown,Machine learning,Unknown,Unknown
viLTe' - chatbot answering relevant questions regarding the COVID-19,Unknown,https://koronastop.lrv.lt/,,"viLTe' was created during a recent hackathon ""Hack the Crisis"" and is capable of answering relevant questions regarding the COVID-19 pandemic, such as the symptons, restrictions and more.",National,Lithuania,Government of the Republic of Lithuania,Governmental,2021/01/01,Unknown,,Health,Public health services.,Unknown,Unknown,Natural language processing,Unknown,Unknown
