name,type,url,contact,description,geoextent,geocoverage,lead_organisation_name,lead_organisation_category,start_date,active,end_date,primary_sector,secondary_sector,cross_sector,cross_border,technology,status,uptake
Tengai - robot in recruitment processes,Unknown,https://www.upplands-bro.se/kommun--politik/om-kommunen/information-om-coronaviruset/nyheter-corona/2020-05-05-kommunen-tar-nasta-steg-i-fordomsfri-rekrytering-med-intervjuroboten-tengai.html,,"The Swedish municipality of Upplands-Bro has started experimenting with the robot Tengai in their recruitment processes since June 2019. Tengai is one of the first interviewer robots developed with the aim to make the recruitment process less biased than traditional interview practices would do. The robot is adopted by the recruitment and staffing agency of the municipality, which has already made their recruitment processes less biased. For the last 10 years already, the agency has not used resumes in their recruitment process and growingly taken an interest in data-driven recruitment tools. Consequently, having a physical robot was regarded as the next step in preventing biases in hiring decisions. The idea behind the use of the robot was to avoid that a human person was present at the beginning of the recruitment process in order to neutralise any psycho-social prejudices. The Tengai robot is the result of a collaboration between the municipality staff and the AI consultancy Furhat Robotics. After the Tengai robot was released, within a week, it was decided to adopt its services permanently. For the company this was also a first time, the municipal recruitment and staffing agency being their first public sector client. The Tengai robot is seen to complement the recruitment process nicely, having been designed not to perceive the age, gender, clothing, background or other looks of interviewed persons. The municipality is using Tengai to first identify candidates with the highest general performance score, in order to make a shortlist for future selections. Here, Tengai works in collaboration with existing staff, as the recruiters analyse competency checks and schedule an interview appointment with Tengai. The robot then conducts the interviews to assess the candidates by analysing their behaviours, problem-solving capacities and other skills. If needed, the robot is able to ask follow-up questions. The interviews are then analysed, combined with the competency scores. Tengai then makes a first selection of promising candidates. The recruiters of the municipality will conduct the final interview with candidates to assess their motivation. The first results following the adoption of the Tengai robot have been regarded as successful and brought significant media attention to the municipality due to the innovative approach to recruitment. According to one of the directors of the municipality, the Tengai robot has made the selection and hiring processes faster, cheaper and more unbiased, freeing up crucial resources to be spent on other tasks.  ",Local,Sweden,Municipality of Upplands-Bro,Governmental,2021/01/01,Unknown,,General public services,General public services n.e.c.,Unknown,Unknown,Audio processing,Unknown,Unknown
Trelleborg - automated social welfare decisions,Unknown,https://valcon.com/insights/trelleborg-robotics-solution/,,"In the municipality of Trelleborg, AI technologies are used to automate various social assistance decisions since 2016. It was the first municipality to use Robotic Process Automation (RPA) to handle various applications on social assistance. At the moment, the automated decision making system is able to process applications for homecare, sickness benefits, unemployment benefits and taxes and has been regarded as a successful example for others to follow. Various other Swedish municipalities are exploring how to implement the Trelleborg model to gain access to the same kinds of benefits. Previously, employees had to manually assess the applications which took considerable amounts of time and costs. With more than 300 applications on social benefits in the municipality every month, citizens sometimes had to wait an average of 8 days on the decision on their welfare-payments, which sometimes leading up to 20 days. As a result of this waiting time, citizens would frequently contact the department about their applications, further increasing the workload of the staff. The decision to use AI to improve the welfare payment process was thought limit the waiting time and consequently various worries of payment delivery by citizens.  Any rejected applications are still handled by people themselves. The automation of the welfare services was not possible if there was not already an online process for people to submit their welfare applications to. In 2015, Trelleborg was the first Swedish municipality to digitalize their administration on social benefits. Already 75% of the citizens used the online platform to access welfare payments which enabled significant data and information to automate this process with RPA technology. Without the data coming from the self-service portal, it would not have been possible to automate these processes. Valcon, a consultancy, helped to develop and implement the RPA platform. As a result of the automation process, the waiting time for citizens on their welfare applications has been significantly reduced. It has been mentioned that many case handling times for people in economically vulnerable situations has been reduced from 10 days to 1 day, with all financial assistance decisions done within 24 hours. In addition, two employees in the Trelleborg administration could be allocated to spend more time on other, value adding tasks such as handling more complex cases.   ",Local,Sweden,Municipality of Trelleborg,Governmental,2021/01/01,Unknown,,Social protection,Social exclusion n.e.c.,Unknown,Unknown,Automated reasoning,Unknown,Unknown
Maxi - chatbot answering questions on insurance,Unknown,https://www.previon.ch/projekte/maxi-der-clevere-chatbot-der-sva-aargau,,"The Social Insurance Aargau SVA has introduced the Maxi Chatbot in order to reduce the number of questions received daily. The chatbot can answer general questions without sensitive data content. In the future, all further emails should run through automated and intelligent (learning) triage and further processing. To do this, requests with personal data must be correctly triaged by the chatbot and, depending on the type of request, directly trigger a process on the specialist application. With the introduction of the ""Maxi"" chatbot, remedial measures were taken and mail inquiries reduced by around 30%.",Regional,Switzerland,Social Insurance Institute of Canton of Aargau,Governmental,2021/01/01,Unknown,,General public services,"Executive and legislative organs, financial and fiscal affairs, external affairs.",Unknown,Unknown,Natural language processing,Unknown,Unknown
NOGAuto - assign or control codes to companies for economic activities ,Unknown,https://www.experimental.bfs.admin.ch/expstat/en/home/innovation-data-science/nogauto.html,,"The employees responsible for the NOGA coding assign or control the codes of the economic activity of the companies based on the available information (input from surveys, description of the economic activity in the commercial register, etc.). This is inevitably coupled with a human and therefore subjective interpretation of the available information, which makes standardized coding difficult. There is the need to develop a tool that can automatically assign the corresponding NOGA codes to the companies registered in the BUR. With automatic coding, at least the same or even higher quality should be achieved than with the current manual coding by the NOGA Group.",National,Switzerland,Federal Office for Statistics,Governmental,2021/01/01,Unknown,,Economic affairs,R&D economic affairs,Unknown,Unknown,Unknown,Unknown,Unknown
Amelia - chatbot helping local residents find city services,Unknown,https://www.ukauthority.com/articles/enfield-joins-microsoft-in-citizenbot-project/,,"Amid budget cuts, the Enfield Council in North London emploies Amelia, an avatar and chatbot personal assistant from IPsoft. Amelia uses artificial intelligence, machine-learning algorithms, and a natural language processor to help local residents find city services. ",Local,United Kingdom,London Borough of Enfield,Governmental,2021/01/01,Unknown,,General public services,"Executive and legislative organs, financial and fiscal affairs, external affairs.",Unknown,Unknown,Natural language processing,Unknown,Unknown
Babylon - health interactive symptom checker,Unknown,https://www.babylonhealth.com/,,"Babylon's interactive symptom checker asks you questions to analyse your condition. Babylon's AI system has been created by experienced doctors and scientists using the latest advances in deep-learning. Much more than a searchable database, it assesses known symptoms and risk factors to provide informed, up-to-date medical information.",National,United Kingdom,National Health Service,Governmental,2021/01/01,Unknown,,Health,"Medical products, appliances and equipment.",Unknown,Unknown,Machine learning,Unknown,Unknown
"DVSA MOT -  Intelligent, data-driven approach to better target Driver and Vehicle Standards Agency (DVSA) resources",Unknown,https://www.gov.uk/government/case-studies/how-the-department-for-transport-used-ai-to-improve-mot-testing,,"The Driver and Vehicle Standards Agency (DVSA) wanted to use a more intelligent, data-driven approach to better target their resources and ensure MOT standards remained high.",National,United Kingdom,Driver and Vehicle Standards Agency,Governmental,2021/01/01,Unknown,,Economic affairs,Transport,Unknown,Unknown,Unknown,Unknown,Unknown
EHPS - early help profiling system to identify children and families considered vulnerable,Unknown,https://www.hackneycitizen.co.uk/2018/10/18/council-360k-xantura-software-profiles-troubled-families/,,"A predictive system called the ""Early Help Profiling System (EHPS)"" used in Hackney County (London), which uses data from a variety of different sources to identify children and families considered vulnerable and at risk of child abuse to the municipality. The data includes statistics from different government agencies, such as school attendance, housing information, economic indicators, and others. This allows early intervention to these families, avoiding the occurrence of a crisis with more expensive follow-up actions.   Each month, the social workers team gets a list of 20 families who are of high risk and unknown to the social workers at that time. Social workers then decide based on the information to conduct an early intervention, such as support from a child centre or a health assessment. It has been reported that the model had a high accuracy, with more than 80% of the risk alerts deemed valid, despite challenges with continuous updating of some data sources. The system was expected to help councils save around one million euro per year by having early, targeted interventions. However, the system was heavily criticized. The nature of the data collection and the risk assessment was very opaque as data is processed by a private company, leading to concerns by citizens. Those whose data was used were not informed and it was kept a secret which indicators were to determine the risks, since a private company was responsible for the development and argued that the information was commercially sensitive. Others noticed that the system was only put in place to cope with the austerity measures put in place, as the system was advertised to maximize payments from the Troubled Families programme.  Now Hackney Council stopped working with the programme as it did not realise the expected benefits.",Local,United Kingdom,Unknown,Governmental,2021/01/01,Unknown,,Health,Family and children.,Unknown,Unknown,Machine learning,Unknown,Unknown
"HART - assessment risk tool, predictive policing based on person data",Unknown,https://www.tandfonline.com/doi/pdf/10.1080/13600834.2018.1458455,,"The Harm Assessment Risk Tool (HART) puts information on a person's past offending history, age, postcode and other background characteristics through algorithms that then classify them as a low, medium or high risk. It is used by the police of Durham and was one of the first reported cases of predictive policing used in the police. ",National,United Kingdom,Durham city police,Governmental,2021/01/01,Unknown,,Public order and safety,Police Services,Unknown,Unknown,Machine learning,Unknown,Unknown
