name,type,url,contact,description,geoextent,geocoverage,lead_organisation_name,lead_organisation_category,start_date,active,end_date,primary_sector,secondary_sector,cross_sector,cross_border,technology,status,uptake
ANPR - car plate recognition,Unknown,https://www.politie.nl/themas/anpr.html,,"The ANPR system uses number plate recognition software for a variety of usages such as paid parking, traffic control, taks avoidance, environmental protection and more. It is used in more than 2000 administrations and is seen as a strong multi-purpose AI application",Local,Netherlands,Dutch Police,Governmental,2021/01/01,Unknown,,Public order and safety,Police Services,Unknown,Unknown,Computer vision,Unknown,Unknown
CAS - crime anticipation system,Unknown,http://ceur-ws.org/Vol-2103/paper_6.pdf,,"The Crime Anticipation System (CAS) makes weekly analyzes based on local and current data. External data about neighborhoods and residents, for example, is supplemented by the police's own knowledge about crimes and local situations and information from Statistics Netherlands. The system searches for crimes that show a pattern - for example, bicycle thefts in a certain neighborhood happen most often between the hours of 9:00 p.m. and midnight. Based on that, the police can better deploy available resources to fight these crimes more effectively, according to the news wire.",Local,Netherlands,City of Amsterdam,Governmental,2021/01/01,Unknown,,Public order and safety,Police Services,Unknown,Unknown,Machine learning,Unknown,Unknown
SyRi - detect welfare fraud,Unknown,https://algorithmwatch.org/en/story/syri-netherlands-algorithm/,,"Various municipalities in the Netherlands have been using the SyRi system to detect welfare fraud more effectively. SyRi has been developed by the Dutch government and uses various risk indicators from existing governmental systems such as taxes, health insurance, residence, education and many more, in order to detect which addresses hold a higher risk of fraud or misuse of welfare benefits.  SyRi was developed in 2014 after multiple municipalities had been creating their own systems to detect fraud. To enable the sharing of different information items that are relevant for SyRi, the system operates on a legal basis which clearly indicates which kind of data can be captured, stored and shared.The system does not make any decisions itself, but provides recommendations for civil servants to conduct further investigations.   Various organisations have opposed the usage of the system. They argue that it causes too many privacy infringements and is discriminatory towards the poor and vulnerable citizens. The lack of transparency on the inner working of the system and the inability of the people affected to get to know their data have been used, has been criticized as well. The UN-rapporteur for Human Rights also expressed his concerns on the use of SyRi as it could be a significant threat to human rights. Some projects revealed significant difficulties in integrating various data sources, which caused the recommendations by the system to become outdated and in fact unusable. In municipalities where the system actually gave recommendations on possible fraudulent behaviour, the success rate was very low. As, the costs of SyRi have been estimated to be over 325.000 euro per year, so that many have been wondering whether the system was worth the privacy and financial costs at all.   Following a court case, the Dutch court decided in early 2020 that the use of SyRi did not comply with Article 8 of the ECHR (European Convention of Human Rights), thus its usage has been cancelled. The judge ruled that the collective, economic welfare interest of preventing fraud weighed insufficiently against the social interest of privacy. Furthermore, the absence of disclosure about the inner working of SyRi makes its usage insufficiently transparent and verifiable.  ",National,Netherlands,Ministry of Social Affairs and Employment,Governmental,2021/01/01,Unknown,,Social protection,Social protection n.e.c.,Unknown,Unknown,Machine learning,Unknown,Unknown
HAL - classification of documents,Unknown,https://www.regjeringen.no/en/dokumenter/nasjonal-strategi-for-kunstig-intelligens/id2685594/?ch=4#id0022,,"The Ministry of Foreign Affairs (MFA) use ML and NLP to analyse and classify reports from embassies and delegations. Every year, the Ministry of Foreign Affairs (MFA) receives up to 6,000 reports from Norwegian embassies, delegations, etc. Previously it was extremely difficult to navigate all this information. Since the MFA adopted machine learning and NLP to analyse and classify the content of these documents, it has been possible to find almost all relevant information on a given subject matter. The solution is also used to extract key information in reports and prepare summaries.  In the work on developing this solution, the MFA cooperated with the University of Oslo, which provided solutions for categorising the Norwegian language. The plan is to gradually expand the solution with information from archives and external research reports.",National,Norway,Ministry of Foreign Affairs,Governmental,2021/01/01,Unknown,,General public services,Foreign economic aid.,Unknown,Unknown,Natural language processing,Unknown,Unknown
Kari - Chatbot,Unknown,https://www.etapasproject.eu/usecases/post-3/,,"The chatbot Kari is an AI-based virtual agent developed for local government bodies – the local municipalities – to answer citizen's questions on the municipality services. It is currently available to the citizens of 80 Norwegian local municipalities – covering about 30% of the Norwegian population, and is in the process of being implemented in other European countries, including Sweden, Finland and Denmark. The chatbots knowledge-base contains over 6000 intents (answers to municipality questions), making it one of the largest in the world. ",Local,Norway,ETAPAS Project: SINTEF-Prokom ,Governmental,2021/01/01,Unknown,,General public services,"Executive and legislative organs, financial and fiscal affairs, external affairs.",Unknown,Unknown,Natural language processing,Unknown,Unknown
Norway Chatbot - chatbot for public administrations ,Unknown,https://www.boost.ai/articles/automation-for-the-people-using-conversational-ai-to-benefit-the-public-sector,,Several Norwegian Government Agencies and municipalities use chatbots based on AI technology. Most of them are based on technology from either boost.ai or Kindly.  Aim is to create a more efficient public sector with better service for citizens.,National,Norway,Kongsberg municipality,Governmental,2021/01/01,Unknown,,General public services,General services.,Unknown,Unknown,Natural language processing,Unknown,Unknown
TrondHeim - Insolvency Predicition,Unknown,https://norden.diva-portal.org/smash/get/diva2:1375500/FULLTEXT01.pdf,,The TrondHeim Municipality has been working on an AI system capable of predicting which companies had a higher chance of become insolvent. This enable the organisation to detect companies at risk at take pre-emptive actions. The predictions were accurate to around 80% a year (an accuracy of 90% would have been much more preferred).,Local,Norway,Trondheim Municipality,Governmental,2021/01/01,Unknown,,Economic affairs,"General economic, commercial and labour affair",Unknown,Unknown,Machine learning,Unknown,Unknown
VDI - Protection of digital infrastructure,Unknown,https://www.regjeringen.no/en/dokumenter/nasjonal-strategi-for-kunstig-intelligens/id2685594/?ch=7,,The existing early warning system for digital infrastructure has been used to detect targeted cyber attacks for almost 20 years. The Norwegian National Security Authority is now developing new sensor technology that will build on and eventually replace the sensors used in the existing early warning system. A new platform will be developed to use artificial intelligence and machine learning on the data collected. The platform will enable automatic analysis of any malware detected as well as automatic sharing of results. It is expected that the AI will enable better cyber security for Norway's critical infrastructure.,National,Norway,Norwegian National Security Authority,Governmental,2021/01/01,Unknown,,Defence,Military defence.,Unknown,Unknown,Machine learning,Unknown,Unknown
Home Quarantine - app on COVID-19 risk,Unknown,https://www.gov.pl/web/cyfryzacja/aplikacja-kwarantanna-domowa--ruszyl-proces-jej-udostepniania,,"The Polish government has developed the free Home Quarantine app for both iPhone and Android, which allows the police to check that individuals do not break quarantine; those who do may be fined up to (at the moment this case was documented, in 2020) PLN 5,000 and also offers support to those who are quarantined. Once users activate the app by entering a phone number and a code sent via SMS, they send a reference photo. Every so often the app sends an unscheduled request for a new photo to be sent within 20 minutes. The system checks both the person (using facial recognition) and the location, essentially replicating what would otherwise be a visit from a police officer. Non-quarantined people cannot sign up, as the app is connected to a database of telephone numbers belonging to those ordered into quarantine. The app also gives access to relevant health information and a hotline. The government intends to add more functionality to the app over time.",National,Poland,Unknown,Governmental,2021/01/01,Unknown,,Health,Public health services.,Unknown,Unknown,Computer vision,Unknown,Unknown
State Clearance Chamber - financial risk indicator,Unknown,https://epf.org.pl/en/wp-content/uploads/sites/3/2019/05/alGOVrithms-State-of-Play-Report.pdf,,"This AI compiles a risk indicator based on collected financial data from financial institutions to determine whether account holders are more likely to conduct illegal activities. If the suspicious activity is detected, at the request of the tax authorities the bank will be able to freeze suspicious accounts. The system is run by the State Clearance Chamber, a key entity of the Polish payment system infrastructure, that renders complex clearing services and other bank services.",National,Poland,"Krajowa Izba Rozliczeniowa S.A (State  Clearance Chamber), Krajowa Izba Rozliczeniowa S.A (State Clearance Chamber)",Governmental,2021/01/01,Unknown,,General public services,"Executive and legislative organs, financial and fiscal affairs, external affairs.",Unknown,Unknown,Machine learning,Unknown,Unknown
CCM-SNS - verification of medical prescriptions,Unknown,https://algorithmwatch.org/en/story/portugal-automated-verification-prescriptions-medical-fraud/,,"In Portugal, the Control and Monitoring Center from the Portuguese Public National Health Service (CCM-SNS), uses data from several databases, in order to detect and fight prescription fraud. It follows a paperless prescription program and the electronic medical prescriptions system which were both implemented in 2016 and made mandatory for the public sector. During the first seven years, the central unit detected irregularities amounting to hundreds of millions of euros, and was instrumental in starting many prosecution for fraud in the health system. According to the Ministry of Health, in the first semester of 2017, the Invoice Control Center processed 356.2 million Euros' worth of prescriptions and flagged 21.1 millions euros to the State prosecutor.",National,Portugal,Portuguese Public National Health Service (Centro de Controlo e Monitorização do Sistema Nacional de Saúde),Governmental,2021/01/01,Unknown,,Health,Health n.e.c.,Unknown,Unknown,Machine learning,Unknown,Unknown
Sigma - chatbot on changing citizens' address,Unknown,https://joinup.ec.europa.eu/sites/default/files/news/2019-09/ISA2_Architecture%20for%20public%20service%20chatbots.pdf,,"For Portuguese residents, it is possible to change their official address via the chatbot Sigma. The provision of services in the informative phase is through the services and entities catalog (CES - Entities and Services Catalogue). ",National,Portugal,"Agency for  Administrative  Modernisation, Agency for Administrative Modernisation",Governmental,2021/01/01,Unknown,,General public services,"General economic, commercial and labour affair",Unknown,Unknown,Natural language processing,Unknown,Unknown
Antonia - automatic processing of requests of public services,Unknown,https://www.romaniajournal.ro/society-people/antonia-the-first-virtual-public-servant-in-romania/,,"The City Hall of Cluj has an AI system called Antonia, which handles the automatic processing of 64 types of forms for requesting public services. The also has a chatbot component so she can answer questions about how to fill the forms. In the second development stage of the AI-based technology, Antonia will become a hologram, this being the surprise-element for the next stage. This depends on how fast we will work out the technical aspects, so there is ""no time estimation for the complete implementation"" according o the local officials in Cluj-Napoca. The project is estimated to be completed within 30 months' period. Antonia has been launched in April 2018 and functions around the clock.",Local,Romania,Municipality of Cluj-Napoca,Governmental,2021/01/01,Unknown,,General public services,"Executive and legislative organs, financial and fiscal affairs, external affairs.",Unknown,Unknown,Natural language processing,Unknown,Unknown
Bucharest airport - face recognition ,Unknown,https://www.uti.eu.com/press-releases/uti-will-implement-face-recognition-and-intelligent-image-analysis-systems-with-otopeni-airport/,,"A facial recognition system will be implemented in Bucharest Airport. The AI will be capable of both identifying wanted persons, terrorism subjects or others on the list of intelligence services as well as a solution which detects suspicious behaviour.",Local,Romania,Bucharest Airport,Governmental,2021/01/01,Unknown,,Public order and safety,Public order and safety n.e.c.,Unknown,Unknown,Computer vision,Unknown,Unknown
Oversi - Chatbot to faster burocracy,Unknown,https://stopbyrokracii.sk/,,The Oversi Chatbot is part of a government initiative to stop the bureaucracy in Slovakia and to apply the once only principle in a digital way. The Chatbot has been invented in order to help find the best solutions and answers to common questions for the general public. ,National,Slovakia,The Office of the Deputy Prime Minister of the Slovak Republic for Investments and Informatization (ODPMII) ,Governmental,2021/01/01,Unknown,,General public services,General services.,Unknown,Unknown,Natural language processing,Unknown,Unknown
PCA - AI algorithms in audit methodology,Unknown,https://dennikn.sk/blog/1561696/big-data-ukazali-nestandardne-predpisovanie-liekov-usporime-tak-statisice-eur/,,Successful use case: AI algorithms (PCA=principal component analysis (less successful) and TSNE +DBScanAlgo ) used in audit methodology when detecting potential fraud when prescribing medicines. .csv data structure + python – Status: Successful implementation and working on a strategy how to scale up. ,National,Slovakia,Institute of health policy  (IZP),Governmental,2021/01/01,Unknown,,Health,Public health services.,Unknown,Unknown,Knowledge representation,Unknown,Unknown
Taxana - chatbot for financial administration,Unknown,https://www.youtube.com/watch?v=UQ_XRlIFtrQ & https://www.podnikajte.sk/dane/taxana-chatbot,,"The Slovakian Financial Administration is the first state institution to launch an automated Chatbot to communicate with its clients, available 24/7. This Chatbot was named Taxana, chosen by the employees of the financial administration combining the English word tax and the Slovak word toy. The system has been put in place as it is argued that the state financial management must continue to digitize and electronic processes to make the processes easier for taxpayers. The introduction of automated chat in communication with their clients will also assist the call center staff, who save time and can thus deal with more complex issues of taxpayers. ",National,Slovakia,Financial Administration,Governmental,2021/01/01,Unknown,,General public services,"Executive and legislative organs, financial and fiscal affairs, external affairs.",Unknown,Unknown,Natural language processing,Unknown,Unknown
Semantic analyser - document analyser for the public administration,Unknown,https://nio.gov.si/nio/asset/semanticni+analizator+besedil,,"Finding relations among text documents (in slovenian language) based on relations among terms used. In development. There is a working prototype. A search engine to find documents with similar content, support to data dictionaries. In development.",National,Slovenia,Ministry of Public Administration,Governmental,2021/01/01,Unknown,,General public services,"Executive and legislative organs, financial and fiscal affairs, external affairs.",Unknown,Unknown,Natural language processing,Unknown,Unknown
060 Service - answer FAQ from citizens and burocratic terms into informal language,Unknown,https://joinup.ec.europa.eu/sites/default/files/inline-files/08-2%20Salvador_Estevan_Martinez%20and%20Doaa_Samy_0.pdf,,"This is a service using Natural Language Processing (NLP) to answer frequently asked questions from citizens and to translate formal public administration terms into more informal terms for citizens. The 060 line is introduced in 2006 as being a central contact point for Spanish citizens with questions about state services, with a certain objective, being the center point of attention for the Spanish citizens, in order to provide information regarding the Central Administration Services and to connect the different public services through one short number: 060.",National,Spain,General Secretariat for Digital Administration,Governmental,2021/01/01,Unknown,,General public services,General services.,Unknown,Unknown,Natural language processing,Unknown,Unknown
Fuengirola Town Hall - measuring beach attendance,Unknown,https://www.euroweeklynews.com/2020/05/04/costa-del-sols-fuengirola-will-use-artificial-intelligence-to-control-capacity-at-beaches-and-public-spaces/,,"The Fuengirola Town Hall representatives aim to use artificial intelligence (AI) in order to control the capacity of beaches and other public spaces. The AI tool is developed by a local company. It allows for real-time information regarding the levels of attendance at beaches to be analysed in order to avoid crowds and minimise the risk of possible Covid-19 infections. This software works by using artificial intelligence sensors that are installed in streetlights. Then, virtual grids are created in which there is a maximum capacity for occupants.  The 3D volume of people entering and leaving these spaces is measured, as well as the amount of people entering the measurement grids. The results of the calculations are carried out in real time in order to warn citizens about means of occupancy (percentages and colours are used as visual warnings).",Local,Spain,Municipality of Fuengirola,Governmental,2021/01/01,Unknown,,"Recreation, culture and religion",Recreational and sporting services.,Unknown,Unknown,Unknown,Unknown,Unknown
Mercé - citizen science for better urban life,Unknown,http://merce.300000.eu/data2/informe_merce.pdf,,"A citizen science experiment in the city of Barcelona: citizens training algorithms to make urban environments more livable. The Mercè project is proposed as a new line of work that applies new machine learning techniques (one of the branches of so-called artificial intelligence) to the disciplines of urban planning, geography, sociology, economics and science. urban health to build objective knowledge and open data about our urban environments. Thus, Mercè is a citizen science experiment that aims to involve citizens in the training of an algorithm that allows us to design more livable cities. Through this experiment it is possible to translate the individual perceptions of many citizens about the habitability of cities into objective knowledge, reusable in urban planning. The relevance and innovation of the project is based on applying information and communication technologies to different transversal fields of knowledge, which have their common denominator in the city. The project develops a workflow based on public / open data and machine learning techniques to promote algorithmic transparency in data science and citizen participation with great social impact.",Local,Spain,City of Barcelona,Governmental,2021/01/01,Unknown,,General public services,"Executive and legislative organs, financial and fiscal affairs, external affairs.",Unknown,Unknown,Machine learning,Unknown,Unknown
Misty II - Robot for elderly people,Unknown,https://www.barcelona.cat/infobarcelona/en/tema/senior-citizens/misty-ii-the-social-robot-becomes-part-of-the-lives-of-twenty-senior-citizens_907645.html,,"Twenty elderly people who live alone and already use services provided by the City Council’s Area for Social Rights are to be accompanied in their daily lives by the social robot Misty II. This is the start of a pilot project to analyse the usefulness of a project created for the challenge ‘Improving the quality of life of senior citizens through technology’, launched by the Barcelona Mobile World Capital Foundation. Users will be selected to live with a robot during a trial period. The pilot aims to discover to which extent the quality of life for senior citizens can be improved through assistance with a social robot, by, for example, reducing isolation, monitoring their health, preventing the forgetting of medicine or appointments.  Additional information can be found at these links: https://www.elespanol.com/invertia/disruptores-innovadores/autonomias/cataluna/20210223/misty-robot-facil-mayores-viven-solos-barcelona/560944535_0.amp.html; https://5gbarcelona.org/pilots/5g-emotional-robot/;  https://docs.mistyrobotics.com/misty-ii/get-started/meet-misty/",Local,Spain,Municipality of Barcelona,Governmental,2021/01/01,Unknown,,Social protection,Old age.,Unknown,Unknown,Robotics and Automation,Unknown,Unknown
VeriPol - detect false police reports,Unknown,https://www.sciencedirect.com/science/article/abs/pii/S095070511830128X,,"The filing of fake police reports is quite common in Spain, especially for low level crimes. This practice is regarded as quite troublesome, as it can bring significant consequences for individuals, wasting valuable police resources and is often used in combination with other fraudulent behaviour. Recently, the Spanish national police have adopted the VeriPol, an AI system in order to detect false police reports. The system was designed to be integrated into the existing Spanish National Police information system called SIDENPOL, allowing for easier use and integration into existing work practices. Its development was the result of a collaborative project between the University of Cardiff, the Charles III University of Madrid and the Spanish National Police. The database of police reports was made available for the researchers of the universities in order to train the AI system on. For this, 1122 reports were used, including 534 true and 588 false reports. VeriPol exploits a combination of Natural Language Processing and machine learning classification algorithms, capable of estimating the probability of false police reports with significant accuracy. In addition to that, the system also enables insights into the differences between false and true police reports. For example, pilot studies found that false police reports are more likely to include shorter statements, focused on the objects which were stolen and lacking details. Following the development, the system was tested in pilot situations in both the police department of Malaga and Murcia. These pilots have been regarded as successful because an increase in the number of false reports was detected. Furthermore, an anonymous survey among the staff showed that the VeriPol system was useful, easy to use but should include more functionalities to detect other forms of crime. Now the system has been rolled out for use by all the departments of the Spanish National Police. The expected impact of the use of the system is to both detect false reports early, leaving more police resources available to focus on other tasks and reports, while at the same time deterring people from filing fake statements in the first place. An additional benefit of the system is to gain more insights into how people lie to police officers as well as to gain more knowledge in detecting true and false police reports. ",National,Spain,Spanish Police,Governmental,2021/01/01,Unknown,,Public order and safety,Police Services,Unknown,Unknown,Machine learning,Unknown,Unknown
Skatti - Answering system about population registration and the income tax return,Unknown,https://www.skatteverket.se/omoss/kontaktaoss/chattamedvardigitalamedarbetare.4.2cf1b5cd163796a5c8b403b.html,,"Skatti answers general questions about population registration and the income tax return for private individuals. You can not get answers to questions about, for example, ongoing or closed cases, or get help with information from the Swedish Tax Agency's register.",National,Sweden,Swedish Tax Agency (Skatteverket),Governmental,2021/01/01,Unknown,,General public services,"Executive and legislative organs, financial and fiscal affairs, external affairs.",Unknown,Unknown,Natural language processing,Unknown,Unknown
