name,type,url,contact,description,geoextent,geocoverage,lead_organisation_name,lead_organisation_category,start_date,active,end_date,primary_sector,secondary_sector,cross_sector,cross_border,technology,status,uptake
Mona - public chatbot on relevant questions for companies on the subject of the corona crisis and the economy,Unknown,https://www.usp.gv.at/Portal.Node/usp/public,,"The new chatbot ""Mona"" is intended to cover all relevant questions for companies on the subject of the corona crisis and the economy. The service of the Federal Ministry for Digitization and Business Location (BMDW) is available online on the ""Unternehmens Service Portal"" (USP, Company service portal ) website and can also be used on mobile devices. The service can be found on the home page of the USP and is intended to provide companies with important information on essential points such as subsidies, labor law matters such as short-time work and teleworking in a simple way during these difficult times . On the one hand, users can ask freely formulated questions, on the other hand there is a classic information channel in which more detailed information is provided step by step on the three central topics of work, financial aspects and research at the click of a mouse.",National,Austria,"Unternehmensservice Portal, Austria",Governmental,2021/01/01,Unknown,,General public services,"Executive and legislative organs, financial and fiscal affairs, external affairs.",Unknown,Unknown,Natural language processing,Unknown,Unknown
AcPaas - technical documents comparison,Unknown,https://acpaas.digipolis.be/nl/product/NLP-engine/about,,"The city of Antwerp has a platform called Antwerp City Platform as a Service (Acpaas) that uses NLP to compare a technical document of a procurement (or an offer/call?) and find the already existent IT components they have in house (API, applications, etc) that could possibly satisfy some of the requirements. To do this, they compare the text of the files of the offer to the ones of the metadata of the components. In the case of the API they do some preprocessing and extract the descriptive information from the metadata files. They also have launched an experimental service that compares technical diagrams with the metadata of the IT components. ",Local,Belgium,Digipolis & city of Antwerp,Governmental,2021/01/01,Unknown,,General public services,General public services n.e.c.,Unknown,Unknown,Natural language processing,Unknown,Unknown
Camera System - mobile phone usage,Unknown,https://www.vias.be/nl/newsroom/succesvolle-test-met-camerasysteem-om-gsm-gebruik-achter-het-stuur-te-detecteren-/,,"Traffic institute Vias is currently testing a new camera system that registers whether a motorist behind the wheel is on the phone with the phone in hand. Using artificial intelligence, the system filters the photos showing that the driver is using a smartphone. Other photos are deleted and faces are made unrecognizable. If the police establishes a violation based on that selection, they can issue a fine.",Local,Belgium,Traffic Institute Vias,Governmental,2021/01/01,Unknown,,Public order and safety,Police Services,Unknown,Unknown,Computer vision,Unknown,Unknown
CitizenLab - citizen participation platform,Unknown,https://www.citizenlab.co/blog/product-update/natural-language-processing-at-citizenlab-how-machine-learning-can-transform-citizen-engagement-projects/,,"Digital participation platforms are important tools for increasing citizen engagement and improving government responsiveness. However, analysing the high volumes of citizen input collected on these platforms is extremely time-consuming and daunting for city officials; this technical difficulty can keep them from uncovering valuable learnings. Setting up a digital participation platform therefore isn’t enough: it’s also necessary to make data analysis more accessible so that civil servants can tap into collective intelligence and make better informed decisions. The challenge of automation that has been faced with, by the civic tech company developing this solution, is shared by the public sector at large. CitizenLab aims to bridge the knowledge gap that currently exists in the public sector.The platform administrators have access to all of this information at a glance in intelligent, real- time dashboards. The topic modelling makes it easy to see what the citizen’s priorities are, and to make decisions accordingly. The CitizenLab Platform is in use in many local authorities which are likely to use some of the elements of the AI to analyse volumes of citizen input.  The main challenge in citizen participation projects isn’t to collect citizens’ input: it’s to analyse it. Overworked and under-resourced administrations often lack the time and technical skills to process the contributions; as a result, valuable insights get lost in the process. By helping administrations effortlessly process citizen input and extract the key ideas,  the  NLP technology has been integrated to the CitizenLab platform, therefore giving civil servants a centralised place to gather, moderate and analyse citizens’ ideas.    (Additional source: https://www.citizenlab.co/case-studies).",National,Belgium,"CitizenLab, Belgium",Governmental,2021/01/01,Unknown,,General public services,General services.,Unknown,Unknown,Natural language processing,Unknown,Unknown
Flemish Infoline - automatic classification,Unknown,https://www.innovatieveoverheidsopdrachten.be/en/projects/1700-supported-artificial-intelligence,,"Natural Language Processing (understanding spoken language) is used to automatically classify incoming telephone questions at the 1700 (Flemish Infoline), to integrally transcribe and document the conversations, and to suggest answers.  With this project, Informatie Vlaanderen wants to optimise the operation of the Flemish Information Line with the help of Artificial Intelligence (AI). Concretely, the project wants to detect and categorise the incoming questions faster and more 'finely-meshed', and also integrate this 'finely-meshed' into the editorial management. In this way, the answers can be suggested more quickly, more adequately and also more 'automatically' to the answer provider, regardless of the chosen communication channel (oral or written). To this end, the project aims to harness the broad potential of AI, with emphasis on Natural Language Processing (NLP), Machine Learning (ML) and Deep Learning (DL), and language and speech technology (Speech-to-Text [STT] and Text-to-Speech [TTS]).  By using AI modules, the project wants to interpret and also 'manipulate' the question/answer process of the Flemish Infoline in order to make the whole process more efficient and automatic, using all the implicit knowledge present in the process. In essence, the project aims at two objectives: (1) the quicker and more efficient capturing and categorising of the question, and (2) the quicker and more efficient forwarding of the 'correctly captioned' question to the 'correct' answer provider with the 'correct' skills, whereby a valid and standardised answer (suggestion) is immediately sent along with it (so that the answer provider does not have to look up the intended answer script).",Regional,Belgium,"Information Flanders, Belgium",Governmental,2021/01/01,Unknown,,General public services,"Executive and legislative organs, financial and fiscal affairs, external affairs.",Unknown,Unknown,Natural language processing,Unknown,Unknown
"Jobnet - reskilling, upskilling and retraining of people",Unknown,https://jobbereik.vdab.be,,"The Flemish Employment and Vocational Training Service (VDAB) is using AI since 2018 which assists in the reskilling, upskilling and retraining of people. The software is called Jobnet and is the combination of a variety of different AI-models into one big AI-model. With the AI, citizens can see which jobs are fitting to their skills, which relevant skills they still lack, starting from their own experience combined with job market data.",Regional,Belgium,Vlaamse Dienst voor Arbeidsbemiddeling en Beroepsopleiding,Governmental,2021/01/01,Unknown,,General public services,"Executive and legislative organs, financial and fiscal affairs, external affairs.",Unknown,Unknown,Machine learning,Unknown,Unknown
Verontrustingen - enabling accurate predictions to detect day-care services which require further inspection,Unknown,https://www.dialogic.nl/wp-content/uploads/2018/06/VTOM-Small-Kids-Big-Data-Frank-Bongers-mei-2018.pdf,,"In 2014, the Flemish Agency for Child and Family (Kind en Gezin) developed an AI system which enables more accurate predictions to detect day-care services which require further inspection. These inspections enable the agencies to keep the quality of the day-care services high and to improve the wellbeing of children. The Child and Family agency does not carry out the inspections itself but works together with the Regional Health Care Inspection Unit of the Department of Welfare, Public Health and Family.  However, there is limited capacity available to conduct all the inspections. For a long period of time, there has been an interest to figure out how to optimise the inspection capacity. The use of data had been considered as way to enhance existing inspection practices and optimize the scarce amount of inspectors. The predictive system developed uses a supervised machine learning method (logistic regression and XGBoost) to analyse various internal and external data from the Health Care Inspection Unit. Combining the recommendations of the predictive system with existing staff experience and expertise enables more targeted and data-driven interventions. ",Regional,Belgium,"Kind en Gezin, Belgium",Governmental,2021/01/01,Unknown,,Social protection,Family and children.,Unknown,Unknown,Unknown,Unknown,Unknown
Plovdic - city Concierge Chatbot,Unknown,https://umni.bg/en/plovdiv-city-concierge-chatbot/,,"City Concierge is an AI-powered city chatbot like a virtual Tourist Office in the mobile. It is there for the visitors 24/7 in Messenger and provides information about the city Point of Interests pf the city. It is possible for tourists and visitors to search information by category and location, or by keyword, or simply ask question about restaurants, entertainment, sightseeing, shopping, transportation and other",Local,Bulgaria,UMNI,Governmental,2021/01/01,Unknown,,General public services,"Executive and legislative organs, financial and fiscal affairs, external affairs.",Unknown,Unknown,Natural language processing,Unknown,Unknown
Andrija - virtual assistant supporting advising suspected COVID-19 infections,Unknown,https://andrija.ai/,,Andrija is a virtual assistant powered by artificial intelligence and has been developed by Croatian IT companies in cooperation with epidemiologists to advise people on how to diagnose and manage suspected COVID-19 infections. The digital assistant is available at https://andrija.ai/ and can be activated on WhatsApp under the name Andrija. ,National,Croatia,Ministry of Health,Governmental,2021/01/01,Unknown,,Health,Public health services.,Unknown,Unknown,Natural language processing,Unknown,Unknown
Hope - chatbot informing work of the Civil Protection Staff,Unknown,https://www.themayor.eu/en/a/view/coronavirus-chatbot-educates-the-citizens-of-vinkovci-4796,,"The Chatbot Hope is used in the City of Vinkovci to inform citizens about the work of the Civil Protection Staff. The chatbot was created pro bono by the Slavonian company Hero Factory, which recently created a similar program for the Croatian Institute of Public Health. The Chatbot can answer questions related to coronavirus, the Civil Protection Staff, e-passes and check for symptons of the virus.",Local,Croatia,Vinkovci munipality,Governmental,2021/01/01,Unknown,,Health,Public health services.,Unknown,Unknown,Natural language processing,Unknown,Unknown
WaterAnalytics - water quality monitoring,Unknown,https://www.wateranalytics.eu/,,The Water Development Department in Cyprus is using AI algorithms for the analysis of water monitoring data (such as hydraulics and water quality).,National,Cyprus,"The Water Development Department, The Water Development Department, Cyprus",Governmental,2021/01/01,Unknown,,Housing and community amenities,Water supply.,Unknown,Unknown,Machine learning,Unknown,Unknown
CHAIN - smart Water optimising energy consumption ,Unknown,https://www.aquatechtrade.com/news/article/video-story-digital-denmark/,,Sensors analyse the water consumption in order to optimise energy consumption in Aarhus municipality. AI will be used to analyze the big amounts of data from sensors about water consumption and to monitor its quality. ,Local,Denmark,Aarhus Municipality,Governmental,2021/01/01,Unknown,,Housing and community amenities,Water supply.,Unknown,Unknown,Machine learning,Unknown,Unknown
Corti's AI - emergency medical services real-time speech analysis for cardiac predictions,Unknown,https://www.weforum.org/agenda/2018/06/this-ai-detects-cardiac-arrests-during-emergency-calls/,,"Corti’s system is an Artificial Intelligence-based speech analysis of real-time, live emergency medical services calls that makes instant predictions to detect out-of-hospital cardiac arrests… with up to 95% accuracy. Used in conjunction with human call-takers and dispatchers, it can significantly reduce error rates and make critical diagnoses faster. The system is already up and running in Copenhagen with impressive results – which is why The European Emergency Number Association (EENA) is getting involved to extend the project. This project is a year-long joint initiative between Corti and EENA to pilot AI support to improve emergency medical service operations.",Local,Denmark,Corti,Governmental,2021/01/01,Unknown,,Health,Public health services.,Unknown,Unknown,Audio processing,Unknown,Unknown
Erhvervsstyrelsen - Detection of errors in business statements,Unknown,https://joinup.ec.europa.eu/sites/default/files/custom-page/attachment/2020-07/Study%20on%20public%20sector%20data%20strategies%2C%20policies%20and%20governance%20%E2%80%93%20ANNEX%20Case%20studies.pdf,,A project by the Danish Business Authority (Erhvervsstyrelsen) to use ML to identify fraud and highlight material errors in financial statements.,National,Denmark,Danish Business Authority,Governmental,2021/01/01,Unknown,,Economic affairs,"General economic, commercial and labour affair",Unknown,Unknown,Machine learning,Unknown,Unknown
Kiri - chatbot for citizens' enquiries,Unknown,https://www.frederiksberg.dk/nyheder/frederiksberg-kommune-deltager-i-forsog-med-chatbot,,"The municipality of Frederiksberg launched an AI-based chatbot (""Kiri"") to answer citizen queries about local services.. When you visit the Frederiksberg Municipality's website you will be able to get help from the chat bot Kiri. It is a digital assistant to whom citizens can ask general questions and answer immediately. The offer is a trial conducted by Gentofte, Gladsaxe, Lyngby-Taarbæk, Rudersdal, Roskilde and Frederiksberg municipalities, and which is inspired by similar trials with good results in Norway.  Initially, Kiri is an attempt, and initially Kiri will only be able to answer questions in the field of citizen services, such as passports and driver's licenses. Kiri is unable to answer specific cases, but will be able to answer the most typical and general questions.",Local,Denmark,Frederiksberg Municipality,Governmental,2021/01/01,Unknown,,General public services,General public services n.e.c.,Unknown,Unknown,Natural language processing,Unknown,Unknown
Enhanced Care Management - prediction model,Unknown,https://www.kratid.ee/haigekassa-kasutuslug,,"In 2015, the Estonian Health Insurance Fund started cooperating with the World Bank to develop and pilot a risk-based management model that would help increase the integration of health services. With risk-based management, GPs can identify patients with multiple chronic diseases on their list for whom additional prevention, counseling and monitoring would be most beneficial to their health and quality of life. If these patients are neglected by the GP teams, this can lead to serious problems, including unnecessary deterioration in health, which not only causes health damage but also unnecessary costs to the healthcare system (avoidable hospitalizations, duplication of examinations, etc.).  The created solution finds the best algorithm for predicting which patients with selected diagnoses are likely to be hospitalized. In the solution, the EHIF database of medical bills first finds certain conditions / diagnoses to be included in the algorithm. Different models have their own strengths, but the differences should not be big.   The results of the solution are comparable to the results of research presented in the literature: John Hopkins Adjusted Clinical Groups (the leading proprietary risk stratification tool) - Haas et al .; Risk-Stratification Methods for Identifying Patients for Care Coordination; The American Journal of Managed Care (September 2013).   The machine learning model is better than the old mechanical model in finding patients at risk.  The solution makes it possible to create a practical model for GP centers to predict which patients are more likely to end up in hospital or at other health risks.  ",National,Estonia,Estonian Health Insurance Fund,Governmental,2021/01/01,Unknown,,Health,Public health services.,Unknown,Unknown,Machine learning,Unknown,Unknown
Iti - chatbot for Statistics Estonia,Unknown,https://www.kratid.ee/statistikaameti-kasutuslugu,,"The virtual assistant called Iti, created in collaboration with the Estonian start-up AlphaBlues, knows the population of Estonia, the size of the pay gap, average wages and consumer price changes, and many other things. Iti also assists the data provider, whose typical questions are related to activities in the electronic data submission portal and filling in questionnaires. If Iti does not know the answer, it will redirect the query based on its content to either the customer support specialist of the data provider or the user of the statistics. Iti has obtained its knowledge from the questions sent through online chats over one year and gets wiser with every query. The number of information requests that Statistics Estonia (the government agency responsible for producing official statistics regarding Estonia) receives is increasing year by year. Iti helps to find information faster thus allowing the customer support of Statistics Estonia to focus on answering more complicated and detailed queries.",National,Estonia,Estonian Statistical Office,Governmental,2021/01/01,Unknown,,General public services,General services.,Unknown,Unknown,Natural language processing,Unknown,Unknown
OTT - predicting employment pathways,Unknown,https://e-estonia.com/new-e-estonia-factsheet-national-ai-kratt-strategy/,,"The Estonian Unemployment Insurance Fund uses profiling to identify the position that suits a job seeker the most. Based on machine-learning software, the solution assists people by suggesting job positions according to their qualifications. The application (OTT) provides job seekers with better and more accurate suggestions on where they could work and offers customized recommendations on re-education and reskilling. OTT is a tool used by civil servants to improve the understanding of the clients’ needs. It is an AI system that employs more than 100 000 client records to estimate the probabilities of different employment pathways, systematizes clients to provide support where it is most needed, and distributes the workload between civil servants. An early version of the project aimed to estimate the probability of becoming long-term unemployed, but this was difficult and not useful. Now, the system finds the probability of finding a new job and is regarded as much more useful. The AI has been created in collaboration with Citis, Nortal and Resta. ",National,Estonia,Estoninan Unemployment Insurance Fund,Governmental,2021/01/01,Unknown,,Social protection,Unemployment.,Unknown,Unknown,Machine learning,Unknown,Unknown
SATIKAS -  detecting the agricultural grasslands changes,Unknown,https://kosmos.ut.ee/en/news/information-system-satikas-helps-detect-mowing-using-satellite-data,,"In the Estonian Agricultural Registers and Information Board (ARIB), AI is used in order to detect whether the agricultural grasslands have been mowed or not using image recognition. This system, called SATIKAS , uses deep learning methods and convolutional neural network approaches to analyse the satellite data coming from the European COPERNICUS programme to automatically detect whether mowing has taken place on the Estonian grasslands. The optical satellite images from Sentinel 1 and 2 are analysed together with reference data of farmer fields, historical inspection logs and meteorological data from the Estonian Weather Service. This AI system is now regarded as one of the first AI applications used by the government in Estonia. The SATIKAS system is still under development and will expand its features and capabilities in the near future. While at the moment the system is able to detect mowing of grass, in the future it will be used for identifying different types of crops and trees as well. ",National,Estonia,ARIB,Governmental,2021/01/01,Unknown,,Economic affairs,"Agriculture, forestry, fishing and hunting",Unknown,Unknown,Machine learning,Unknown,Unknown
SUVE - chatbot for questions about the emergency situation,Unknown,https://eebot.ee/,,"The websites of several Estonian government agencies now have Suve, an automated chatbot which provides answers to frequently asked questions about the emergency situation and the coronavirus. The chatbot provides answers to questions in Estonian and English and uses information from the official sources of government agencies. The development of the Chatbot is the result of a hackathon which was organized in the early weeks of the COVID-19 outbreaks in Europe. Together with the Estonian start-up community, Suve was developed in rapid fashion. By using official information from government agencies, the role of Chatbot is to provide trustworthy information regarding the coronavirus and emergency situation in Estonia and to tackle misinformation.   https://www.valitsus.ee/en/news/chatbot-will-help-you-find-answers-your-questions-about-crisis",National,Estonia,Unknown,Governmental,2021/01/01,Unknown,,Health,Public health services.,Unknown,Unknown,Natural language processing,Unknown,Unknown
Texta Toolkit - text analytics tasks,Unknown,https://www.texta.ee/home,,"The Ministry of Education and Research performed a document management audit using the Texta Toolkit, which was aimed at identifying the documents that had been published without authorisation (e.g. internal documents, personal data, etc.). During the audit, more than 1,200,000 documents were analysed, converted into machine-readable form and had the personal data removed. In collaboration with the Centre of Registers and Information Systems, the Ministry of Justice removed, using Texta, personal data from nearly 80,000 court decisions involving information about punishments deleted from the Criminal Records Database and republished the decisions in the Court Information System. Texta Toolkit grew out of industrial research in the Software Technology and Applications Competence Center (STACC) and its development has been supported from the Estonian Language Technology programme.",National,Estonia,Ministry of Education and Research,Governmental,2021/01/01,Unknown,,General public services,General services.,Unknown,Unknown,Natural language processing,Unknown,Unknown
X-Road - data excange anomalies,Unknown,https://www.kratid.ee/ria-kasutuslugu,,"The Information System Authority (RIA) uses an AI application to detect anomalies and incidents in our Data Exchange Layer (X-road) monitoring. Essentially, previous data exchange periods are compared with the current one and differences are sought. If the system is unable to identify whether a situation is erroneous or permitted, the system user currently has to decide. Based on the feedback, the system learns how to make better decisions and will be able to detect anomalies and incidents more accurately in the future.",National,Estonia,State Information Systems Board RIA,Governmental,2021/01/01,Unknown,,General public services,General public services n.e.c.,Unknown,Unknown,Machine learning,Unknown,Unknown
Case Fiva (RPA) - support the Financial supervisory Authority,Unknown,https://julkaisut.valtioneuvosto.fi/bitstream/handle/10024/161688/41_19_Leading%20the%20way%20into%20the%20age%20of%20artificial%20intelligence.pdf?sequence=4,,"The Financial Supervisory Authority is an example of a government agency that uses  artificial intelligence. The Financial Supervisory Authority is a financial and insurance supervisory agency, which does not always have adequate resources for its tasks. Robotics   and artificial intelligence have eased the situation and their use has also led to a sharp   fall in the number of human errors. The Financial Supervisory Authority supervises the   operations of banks, insurance and pension insurance companies, other actors in the   insurance sector, investment firms, fund management companies and the Helsinki Stock   Exchange. The supervised entities provide 95% of the funding for the operations and the   remaining five per cent comes from the Bank of Finland.",National,Finland,The Financial Supervisory Authority,Governmental,2021/01/01,Unknown,,General public services,"Executive and legislative organs, financial and fiscal affairs, external affairs.",Unknown,Unknown,Unknown,Unknown,Unknown
